{
  "meta": {
    "slug": "derechos_sociales",
    "titulo": "Julio sin tregua",
    "subtitulo": "En julio de 2026, zonas periféricas de La Habana cumplieron tres meses sin agua potable, el sistema eléctrico colapsó por completo al menos tres veces y Cubalex contó nueve feminicidios, la cifra más alta de su serie mensual. El propio informe describe julio como el mes de mayor violencia ciudadana desde que comenzó su monitoreo en 2022 — pero, a diferencia de los feminicidios, esa cifra total no ha sido confirmada por una segunda fuente.",
    "descripcion": "El informe mensual de Cubalex sobre derechos humanos en Cuba correspondiente a julio de 2026 documenta dos crisis que avanzan en paralelo: el colapso sostenido de las condiciones materiales de vida (derechos económicos, sociales y culturales) y un repunte agudo de violencia ciudadana. Este expediente separa ambos hilos y verifica cada uno por su cuenta, sin fusionarlos en una sola narrativa de \"todo empeora igual\".\n\nEn el frente de derechos económicos, sociales y culturales, tres hechos quedaron corroborados por fuentes independientes de Cubalex. Primero, zonas periféricas de La Habana, como Arroyo Naranjo, llevaban más de tres meses sin agua potable regular. Segundo, el Sistema Electroenergético Nacional sufrió al menos tres desconexiones totales durante julio (6, 10 y 14 de julio, según prensa independiente), además de apagones locales prolongados. Tercero, el sistema de salud reportó escasez de insumos para diálisis, condiciones extremas en áreas de neonatología y fallas de higiene en infraestructura sanitaria. A esto se suma el cierre del 73% del parque hotelero cubano, coincidiendo con la salida de las cadenas españolas Meliá, Iberostar y Barceló, y un paquete de 176 medidas económicas que incluyó la eliminación de 92.000 plazas estatales y atrasos salariales de hasta seis meses en algunos territorios.\n\nEn el frente de violencia ciudadana, la verificación produjo un resultado más matizado. Cubalex reportó 9 feminicidios en julio: esa cifra fue corroborada de forma independiente por el Observatorio de Género de Alas Tensas (OGAT), que llegó al mismo número por su cuenta. Pero la cifra de 37 homicidios totales —que el informe describe como la más alta desde que Cubalex inició su monitoreo en 2022— no pudo confirmarse: es una afirmación autorreferencial sobre la propia serie histórica de Cubalex, y otro monitor independiente, Cubanet, contó alrededor de 20 muertes violentas para el mismo mes, con una metodología distinta. Los 4 suicidios que reporta Cubalex, también descritos como el máximo del año, tampoco tienen respaldo de una segunda fuente: Cuba no publica estadística oficial mensual de suicidios.\n\nEste expediente no oculta esa divergencia ni la resuelve por decreto: presenta la cifra de Cubalex marcada como no confirmada, junto a la cifra de contraste de Cubanet, para que quede visible que dos monitores independientes, con metodologías distintas, llegan a números distintos sobre el mismo mes. La denuncia del informe original sobre un presunto desvío de ayuda humanitaria estadounidense distribuida vía Cáritas en la provincia de Granma tampoco pudo confirmarse: el inicio de la distribución del paquete de 100 millones de dólares sí está corroborado, pero no las denuncias de desvío o reventa.\n\nLo que si tiene el mismo diagnóstico en ambas fuentes -Cubalex y prensa independiente por separado- es la fotografía general del mes: una población que entró en agosto de 2026 sin agua regular en algunos barrios, con el sistema eléctrico colapsando por tercera vez consecutiva en cuestión de semanas, con un sistema de salud que no puede garantizar insumos básicos, y con una violencia social que, se mida como se mida, alcanzó uno de sus puntos más altos documentados.",
    "narracion": "En julio de dos mil veintiséis, zonas periféricas de La Habana cumplieron más de tres meses sin agua potable regular. El sistema eléctrico nacional colapsó por completo al menos tres veces durante el mes, y los hospitales reportaron escasez de insumos para diálisis y condiciones extremas en salas de neonatología. Cerró el setenta y tres por ciento del parque hotelero cubano, coincidiendo con la salida de las cadenas Meliá, Iberostar y Barceló. El Estado eliminó noventa y dos mil plazas de trabajo como parte de un paquete de ciento setenta y seis medidas económicas. En paralelo, Cubalex contó nueve feminicidios en julio, cifra confirmada de forma independiente por el Observatorio de Género Alas Tensas. Pero la cifra de treinta y siete homicidios totales, que el informe describe como la más alta desde dos mil veintidós, no pudo confirmarse con una segunda fuente: otro monitor, Cubanet, contó alrededor de veinte muertes violentas ese mismo mes, con una metodología distinta. Los cuatro suicidios reportados tampoco tienen respaldo independiente. Este expediente separa siempre la crisis de derechos económicos y sociales, mejor verificada, de la violencia ciudadana, donde persiste una divergencia real entre monitores. Ninguna cifra se presenta como cierta si depende de una sola fuente.",
    "version": "1.0.0",
    "fecha_datos": "2026-07-31",
    "advertencia": "La cifra de 37 homicidios y la de 4 suicidios en julio de 2026 son propias del monitoreo de Cubalex y no fueron confirmadas por una segunda fuente: Cubanet, un monitor independiente, contó alrededor de 20 muertes violentas el mismo mes con una metodología distinta. Los 9 feminicidios sí fueron corroborados de forma independiente por el Observatorio de Género Alas Tensas. Las denuncias de desvío de ayuda humanitaria en Granma tampoco se confirmaron."
  },
  "intro": {
    "parrafos": [
      "El informe mensual de Cubalex sobre derechos humanos en Cuba de julio de 2026 documenta dos crisis paralelas: el colapso de las condiciones materiales de vida (agua, electricidad, salud) y un repunte de violencia ciudadana. Este expediente las trata como dos series separadas, cada una verificada por su cuenta.",
      "En derechos económicos, sociales y culturales, tres meses sin agua potable en zonas periféricas de La Habana, al menos tres apagones nacionales totales y una crisis sanitaria con escasez de insumos quedaron corroborados por fuentes independientes de Cubalex.",
      "En violencia ciudadana, los 9 feminicidios de julio fueron confirmados por un segundo monitor (Alas Tensas), pero los 37 homicidios totales —presentados como el máximo desde 2022— no lo fueron: Cubanet, otro monitor independiente, contó alrededor de 20 para el mismo mes. Ambas cifras se muestran, marcadas según su estado de verificación."
    ]
  },
  "desc": {
    "agua": {
      "resumen": "Zonas periféricas de La Habana, como Arroyo Naranjo, llevaban más de tres meses sin agua potable regular a julio de 2026.",
      "hechos": [
        { "afirmacion": "Municipios periféricos de La Habana, entre ellos Arroyo Naranjo, acumulaban más de tres meses sin agua potable regular.", "confianza": "corroborada", "fuente": "Diario de Cuba" },
        { "afirmacion": "La crisis hídrica se suma a la eléctrica como parte de un patrón de colapso estructural de servicios esenciales, según el informe de Cubalex.", "confianza": "corroborada", "fuente": "Cubalex (informe julio 2026)" }
      ]
    },
    "electricidad": {
      "resumen": "El Sistema Electroenergético Nacional (SEN) sufrió al menos tres desconexiones totales durante julio de 2026, además de apagones locales de varios días consecutivos.",
      "hechos": [
        { "afirmacion": "El SEN colapsó por completo al menos tres veces en julio de 2026 (6, 10 y 14 de julio).", "confianza": "corroborada", "fuente": "14ymedio, CiberCuba, Diario de Cuba" },
        { "afirmacion": "Se registraron además apagones locales prolongados, de varios días consecutivos, en distintas provincias.", "confianza": "corroborada", "fuente": "Cubalex (informe julio 2026), 14ymedio" }
      ]
    },
    "salud": {
      "resumen": "El sistema de salud reportó escasez de insumos para diálisis, condiciones extremas en áreas de neonatología y fallas de higiene en infraestructura sanitaria.",
      "hechos": [
        { "afirmacion": "Hospitales como el Hermanos Ameijeiras reportaron escasez de insumos para tratamientos de diálisis.", "confianza": "corroborada", "fuente": "Infobae, Diario de Cuba" },
        { "afirmacion": "Se documentaron condiciones extremas en áreas de neonatología, incluida la falta de equipamiento adecuado.", "confianza": "corroborada", "fuente": "Infobae, Diario de Cuba" },
        { "afirmacion": "Se reportaron fallas de higiene en infraestructura sanitaria hospitalaria.", "confianza": "corroborada", "fuente": "Diario de Cuba" }
      ]
    }
  },
  "violencia": {
    "homicidios": { "valor": 37, "etiqueta": "homicidios en julio de 2026, según Cubalex", "confianza": "no_confirmada", "fuente": "Cubalex (informe julio 2026)", "nota": "Cifra autorreferencial de la serie propia de Cubalex, descrita como la más alta desde el inicio de su monitoreo en 2022. Otro monitor independiente, Cubanet, contó alrededor de 20 muertes violentas para el mismo mes con una metodología distinta. Ver comparativa_homicidios." },
    "feminicidios": { "valor": 9, "etiqueta": "feminicidios en julio de 2026", "confianza": "corroborada", "fuente": "Cubalex; confirmado de forma independiente por el Observatorio de Género Alas Tensas (OGAT)" },
    "suicidios": { "valor": 4, "etiqueta": "suicidios en julio de 2026, según Cubalex, el máximo del año", "confianza": "no_confirmada", "fuente": "Cubalex (informe julio 2026)", "nota": "Cuba no publica estadística oficial mensual de suicidios; no se localizó ninguna fuente independiente con cifra propia para julio de 2026." },
    "otros_hechos": {
      "descripcion": "El resto de los hechos de violencia correspondió mayormente a robos y asaltos violentos, ejecutados con machetes y armas de fuego, en un contexto de crisis de combustible que ha impulsado el robo de vehículos, motos y triciclos.",